{
  "$schema": "https://vite.icebreaker.top/app.json",
  "pages": [
    "pages/index/index",
    "pages/logs/logs"
  ],
  "window": {},
  "style": "v2",
  "rendererOptions": {
    "skyline": {
      "defaultDisplayBlock": true,
      "disableABTest": true,
      "sdkVersionBegin": "3.0.0",
      "sdkVersionEnd": "15.255.255"
    }
  },
  "componentFramework": "glass-easel",
  "sitemapLocation": "sitemap.json",
  "lazyCodeLoading": "requiredComponents"
}
